{"$schema":"https://json-schema.org/draft/2020-12/schema","additionalProperties":false,"properties":{"decisionCode":{"type":["string","null"]},"decisionDate":{"format":"date-time","type":["string","null"]},"decisionRejectReason":{"type":["string","null"]},"decisionUserId":{"format":"uuid","type":["string","null"]},"description":{"type":["string","null"]},"id":{"format":"uuid","type":"string"},"locationCity":{"type":["string","null"]},"locationCountryCode":{"type":["string","null"]},"name":{"type":["string","null"]},"proposalDate":{"format":"date-time","type":"string"},"proposalUserId":{"format":"uuid","type":"string"},"statusCode":{"type":["string","null"]}},"required":["id","proposalDate","proposalUserId"],"title":"MeetingGroupProposalDto","type":"object"}