[{"decisionCode":"Accept","decisionDate":"#TS#","decisionRejectReason":null,"decisionUserId":"#GUID_0001#","description":"Group for software craft passionates","id":"#GUID_0004#","locationCity":"Warsaw","locationCountryCode":"PL","name":"Software Craft","proposalDate":"#TS#","proposalUserId":"#GUID_0001#","statusCode":"Verified"}]